rowname,title,body_text,categories
1459,большой блюзовый концерт в клубе «Башни»,"4 июня на сцену петербургского клуба «Башни» выйдут две группы, известные своими фееричными живыми шоу и верностью блюзовым традициям. Команда BlinBlues.COM исполняет блюз с 2008 года. Блюз-рокеры The Mojoworkers существует более трёх лет, беря на вооружение хиты Би Би Кинга, Бадди Гая, Мадди Уотерса и других великих мастеров. Участники большого блюзового концерта готовят для слушателей грандиозный сюрприз. Известно лишь, что речь идёт о новом звучании старых песен. Кроме того, блюзовый квадрат и соло на губной гармошке в этот вечер разбавят жаркие ска-наигрыши команды Porto Franco, которая впервые выйдет на сцену «Башен». Справки по телефону: +7 (921) 966-64-64.",concert
1467,концерт группы «СБПЧ»,"Когда в 2007 году на лейбле «Снегири» Олега Нестерова вышел дебютный альбом «Самого Большого Простого Числа», это произвело мини-сенсацию на электронной сцене и в инди-кругах. IDM-проект Кирилла Иванов и группой «Ёлочные игрушки» находится в постоянном творческом поиске, и гости петербургского Roof Music Fest получат возможность оценить новую работу «СБПЧ», участники которого, по их словам, вновь пережили метаморфозу и взялись за «дикое диско».",concert
1468,акция: концерт «Триада vs. Нигатив» в клубе «Космонавт» со скидкой 50 %,"В прошлом сезоне группа «Триада» отпраздновала своё 15-летие, а её участник рэпер Нигатив презентовал новый ЕР. На концерте музыкант представит сразу две программы — сольную и в составе группы. Группа «Триада» начала записываться в 1999 году, её основоположниками были музыканты Jazzz, Rico и Нигатив, вскоре к ним присоединился Крес (DJ KresBeatz). Состав постоянно менялся, и только в 2002 году сформировался таким, какой он есть и сейчас. Несмотря на прежнее название, группа состоит только из двух исполнителей (зато каких) — Нигатива и Дино. Дуэт продолжает создавать хип-хоп и оставаться одним из ведущих рэп-коллективов в стране. За всё время существования «Триада» выпустила десяток альбомов, выезжала на гастроли в Европу, завоевала целый ряд музыкальных наград и даже выпустила книгу. Чтобы стать одним из 50 обладателей билетов с пятидесятипроцентной скидкой, вам понадобится:  Поделиться записью в ВКонтакте. Отправить администратору заявку с названием концерта, необходимым количеством билетов, вашим телефонным номером и именем.  Подробнее о концерте, сроках проведения и организаторе можно узнать в официальной группе в ВКонтакте.",stock
1470,акция: билеты на симфонический концерт «Времена года. Лето» со скидкой 50 %,"Большой симфонический концерт в зале Петрикирхе — это посвящение двум музыкальным гениям, Моцарту и Вивальди. В программе вечера «Времена года. Лето» — популярные произведение великих композиторов, а также их малоизвестные произведения. Это делает программу уникальной — ведь поклонники классической музыки смогут услышать любимые мелодии и, вместе с тем, открыть для себя что-то новое. Магазин «ГорБилет» проводит очередную акцию, которая позволит приобрести билеты на концерт «Времена года» со скидкой до 50 %. Так, места в 1-3 ряды будут стоить 490 рублей вместо 700, билеты в партер — 350 рублей вместо 650, места на балконе — 300 рублей вместо 600. Для того, чтобы воспользоваться предложением, нужно:  Сделать в ВК репост записи группы «ГорБилет». Написать администратору группы личное сообщение, указав название мероприятия, количество билетов для бронирования, ваш контактный номер телефона, а также имя и фамилию, если они отличаются от данных соцсети.  Подробнее о концерте, сроках проведения и организаторе можно узнать в официальной группе в ВКонтакте.",stock
1472,акция: концерт и шоу ансамбля ударных инструментов MarimbaMix со скидкой 37 %,"Ансамбль MarimbaMix в составе ксилофона, экзотической маримбы и вибрафона в сочетании с другими тембрами — это яркий профессиональный коллектив с уникальным стилем исполнения. Музыканты группы — солисты ведущих оркестров Петербурга, лауреаты престижных конкурсов. Ансамбль открывает для слушателей неожиданное звучание хорошо известных композиций, представляя их в своей уникальной обработке. Репертуар MarimbaMix — это феерический калейдоскоп самых разных музыкальных жанров, стилей, эпох и направлений. В одном концерте могут соседствовать чувственный soul, джазовые импровизации, произведения из сокровищницы мировой классики. Чтобы приобрести билеты на концерт с привлекательной скидкой, вам понадобится:  Поделиться записью с друзьями в ВКонтакте. Отправить администратору заявку с названием концерта, необходимым количеством билетов, вашим телефонным номером и именем.  Подробнее о концерте, сроках проведения и организаторе можно узнать в официальной группе в ВКонтакте.",stock
1475,концерт Panic! At the Disco,"Выходцы из Лас-Вегаса, Panic! At The Disco воплотили в своём творчестве буйство красок, контрасты и артистизм столицы азартных игр и шоу-бизнеса в штате Невада. От поп-панка музыканты легко переходят к цирку, от кавера на Queen — к довольно тяжёлой альтернативе. Чем удивят Panic! At The Disco российскую публику во время концерта в клубе «А2»? Пока это секрет, но нет сомнений, что это шоу будет одним из самых грандиозных во время петербургского летнего сезона.",concert
1481,акция для студентов от Food Truck Cafe,"С 7 апреля студенты различных факультетов и вузов соревнуются между собой в Food Truck Cafe и получают скидку до 25 %. Чтобы воспользоваться акцией, достаточно прийти с друзьями в кафе до или после пары, сделать заказ и показать студенческий. Вы также сможете воспользоваться той скидкой, которая уже накоплена вашим факультетом или университетом. За каждые 500 рублей в счете учебного заведения добавляется еще 1 % скидки. Меню Food Truck Cafe включает ведущие блюда уличной кухни со всего мира: бургеры, буррито, хот-доги, фалафель. В уютной атмосфере кафе на Василеостровской можно не только сытно перекусить, но и перевести дух после учебы. Телефон для бронирования столиков: + 7 (812) 907-42-45.",stock
1482,прогулки на теплоходе по каналам Санкт-Петербурга со скидкой до 64 %,"После весеннего схода льдов в Петербурге открывается сезон речного транспорта. На борту современных теплоходов есть комфортные посадочные места на открытой палубе, тёплый закрытый салон и другие удобства. Маршруты проходят мимо Зимнего дворца, Адмиралтейства и Петропавловской крепости. Дневные и ночные  прогулки на теплоходах — прекрасная возможность насладиться всеми красотами города и взглянуть на привычные достопримечательности с нового ракурса. Если вы хотите узнать подробнее об акции, её сроках и связаться с организаторами, нажмите кнопку «Получить скидку».",stock
1483,полёт на флайборде со скидкой до 62 %,"Флайборды появились в России сравнительно недавно. Это микс активного отдыха и развлечения, а также отличная возможность испытать на себе, что же такое настоящий полёт. Занятия проходят на закрытой территории специализированного парка SunPark («СанПарк»). Отважным любителям экстрима предоставят полный комплект снаряжения и защитную экипировку. В стоимость абонемента также включён обязательный вводный инструктаж. После полёта вам предложат горячий душ и чай со сладостями. Если вы хотите узнать подробнее об акции, её сроках и связаться с организаторами, нажмите кнопку «Получить скидку».",stock
1484,игра в бампербол со скидкой до 60 %,"Бампербол — безопасный футбол с футуристичной амуницией. Игроки надевают специальные надувные шары («зорбы»), в которых голова, тело и руки находятся внутри, а свободными остаются только ноги. Это не только соревнование, но возможность от души подурачиться в компании друзей. Вам всё объяснят и покажут! Матч идёт по простым правилам и длится несколько таймов по 5-7 минут.  Захватывающий аттракцион гарантирует море смеха и веселья. Если вы хотите узнать подробнее об акции, её сроках и связаться с организаторами, нажмите кнопку «Получить скидку».",stock
1485,дневная или ночная прогулка на теплоходе по рекам и каналам Петербурга со скидкой до 57 %,"Хотите приятно провести время, насладиться красотой любимого города и познакомиться с его историей? Отправляйтесь в путешествие на теплоходе по водной глади малых рек, каналов и величественной Невы. Дневные прогулки — излюбленный досуг туристов и гостей города. Такие путешествия помогают заново взглянуть на знакомые очертания улиц и памятники архитектуры. А во время ночных поездок можно увидеть легендарную разводку мостов и отдохнуть в компании друзей. Если вы хотите узнать подробнее об акции, её сроках и связаться с организаторами, нажмите кнопку «Получить скидку».",stock
1489,фотовыставка Алексея Корзова Black and White,"Алексей Корзов увлёкся фотографией в 2008 году. Тогда он учился в Университете аэрокосмического приборостроения и работал в Российской национальной библиотеке. Со временем хобби стало для него чем-то большим. При этом карьера в совершенно другой сфере позволила оставить фотографию исключительно для творческой самореализации. Первая персональная выставка Корзова включает в себя чёрно-белые портреты знаменитых жителей Петербурга. Особый интерес у фотографа вызывает музыкальная среда, и потому зачастую героями его снимков становятся участники известных групп. Посетители без труда узнают музыкантов таких коллективов, как Animal Джаz, Stigmata, Amatory, Jane Air, Alai Oli и других. Открытие выставки Black and White («Чёрное и белое») состоится 20 мая в 19:00 в Месте встречи «Казанская, 7». В этот день гостей ждёт встреча с Корзовым, который ответит на любые вопросы об искусстве фотографирования, технической стороне процесса, обработке снимков. Детали уточняйте по телефону +7 (921) 641-44-69.",exhibition
1493,концерт Manu Chao,"Альбомы Manu Chao расходятся по миру огромными тиражами, но сам музыкант остаётся верен своим революционным убеждениям. Он отказывается от дуэта с Мадонной, но не прочь выступить перед преданной аудиторией в маленьком клубе. В России Manu Chao гостил семь лет назад, так что его фанаты уже предвкушают тот час, когда пламенный борец с глобализмом выйдет на сцену петербургского клуба «А2» с программой хитов из старых пластинок и новых гимнов во славу свободы.",concert
1494,концерт Billy Talent,"Выходцы из канадской провинции Онтарио, Billy Talent находятся на виду с конца 90-х, когда отказались от не самого благозвучного (и, тем более, занятого одной американской группой) названия Pezz, а парой лет спустя разродились дебютной пластинкой имени себя. С тех пор на родине команда достигла статуса национального достояния, выпустила несколько мультиплатиновых альбомов и заработала полдюжины местных «Грэмми». Оно и неудивительно: критики до сих пор ломают голову над тем, какую музыку играют эти парни, относя их творчество то к альтернативе, то к ска-панку, то к инди-року, а то и вовсе к хип-хопу. На самом деле, Billy Talent действительно не придерживаются одного стиля: даже в рамках отдельно взятого альбома у них можно обнаружить абсолютно разные по звучанию песни. Не исключено, что новая пластинка станет очередным жанровым экспериментом, но уже абсолютно точно известно, что одними из первых оценить её в живом звучании смогут гости питерского «Космонавта».",concert
1495,"выставка «Розмари Трокель. Рисунки, объекты, видеоарт»","Розмари Трокель — уникальная фигура на международной арт-сцене. Она разрушила многовековую стену, разделявшую «высокое искусство» и рукоделие — женские занятия, никогда не претендовавшие на художественный статус. О Трокель публика узнала в начале 1980-х годов, когда в немецком искусстве царствовали мужчины — Йозеф Бойс, Георг Базелиц, Зигмар Польке. Трокель не стала подстраиваться под существующие каноны, разработав собственную творческую систему, основанную на сопоставлении маскулинного и фемининного. Её первыми произведениями были вязаные картины, которые мгновенно покорили публику и оказались в лучших музеях и галереях мира, разрушив стереотипы о «вяжущей домохозяйке». Другой источник вдохновения Трокель — кухонные конфорки, образ которых золотой нитью проходит через всё её творчество. Художница обращается к самым разным видам искусства — живописи, фотографии, скульптуре, коллажу, инсталляции, видеоарту. Экспозиция на новой площадке Центра современного искусства имени Сергея Курёхина представит её работы во всём многообразии. Вернисаж состоится 21 апреля в 18:00. В этот день арт-критик Ан Пенхюзен проведёт по выставке экскурсию. 23 апреля в 17:00 пройдёт беседа «Космос Розмари Трокель» с участием Пенхюзен.",exhibition
1502,выставка «Картины ускользающего мира. Золотой век японской графики»,"«Картины ускользающего мира» (по-японски «укиё-э») достигают своей популярности в период возвышения Эдо (современного Токио). Эта эпоха — «золотой век» литературного, театрального и изобразительного искусства страны. О таких художниках, как Китагава Утамаро, Кацусика Хокусай, Утагава Кунисада и Андо Хиросигэ знали далеко за пределами их родины. В экспозицию войдут работы этих и других мастеров ксилографии. Они продемонстрируют наслаждение их авторов сиюминутными явлениями, выхваченными из бурной реки времени. Японская весна начинается 3 марта в арт-центре «Перинные ряды» и продолжится до 29 мая. На это время арт-центр становится настоящим японским жилищем, декорированным цветными гравюрами. Поддержат атмосферу миниатюрные деревья бонсай, искусственный водоём с пёстрыми карпами кои. Экскурсии будут проводиться: 1 апреля, 8 апреля, 15 апреля и 29 апреля в 19:00, 3 апреля и 10 апреля в 12:00. Внимание! Количество мест ограничено! Если количество заявок будет превышать возможности «Арт-центра», администрация может предложить вам записаться на другую дату, либо на индивидуальную экскурсию. Записаться можно по телефону + 7 (812) 448-20-28, либо написав Асе Ершовой.",exhibition
1503,выставка «Первозданная Россия»,"В экспозицию «Первозданная Россия» входят лучшие фотографии, принимавшие участие в одноимённом фестивале, который проводится с 2014 года. О великолепии северного сияния поведают снимки Валентина Жиганова, темпераменте Байкала — работы Валерия Малеева, животном мире Камчатки — фотографии Геннадия Юсина, полуострове Таймыр — произведения Сергея Горшкова. Выставка в ЭТАЖАХ позволит посетителям совершить незабываемое путешествие по России, заглянуть в самые «дикие» уголки страны и познакомиться с их обитателями. В общей сложности зрители увидят около 150 фотографий. В рамках проекта запланированы мастер-классы от именитых фотографов, встречи с путешественниками, лекции, презентации проектов по защите окружающей среды, кинопоказы.",exhibition
