rowname,title,body_text,categories
1064,концерт Ольги Максимовой в оранжерее,"Мы привыкли, что арфа — обитательница классических филармоний, и чтобы услышать её звучание, нужно собираться и идти на концерт серьёзной музыки. Ольга Максимова с успехом ломает этот стереотип и дарит своим слушателем необычайно нежные мелодии с лёгкими цифровыми акцентами — получается невероятный космический звук. На концерте в оранжерее вас ждёт погружение в особое арфа-состояние. Вы буквально прочувствуете и впитаете каждую ноту.",concert
1065,концерт группы «Ундервуд»,"Владимир Ткаченко и Максим Кучеренко встретились в 1993 году в Симферополе, навcегда сохранив в своём творчестве беззаботную и солнечную атмосферу каникул у моря. При всей легкомысленности песен «Ундервуд» вполне себе ветераны: на сцене они уже больше двух десятилетий. Для концерта в петербургском клубе Aurora Concert Hall Владимир и Максим исполнят лучшие творения от ранних хитов «Гагарин, я вас любила!» и «Парабеллум» до песен с последнего на сегодняшний день «ундервудского» альбома «Без берегов».",concert
1073,интерактивная выставка «Живой свет» в Музее оптики Университета ИТМО,"Хотя без света и невозможно представить себе жизнь на земле, всё же для человека это что-то весьма привычное, даже обыденное. На экспозиции с помощью оригинальных инсталляций, эффектов и опытов вас постараются убедить в обратном — свет удивителен! Его характеристики изучает один из разделов физики — оптика. Учёные накопили огромную базу знаний об этом явлении, а создатели выставки готовы поделиться ими с вами. Прогулка по музею одинаково заинтересует маленьких гостей, тинейджеров и взрослых. Для каждой возрастной группы найдётся своя особенная экскурсия, во время которой ведущие доступным языком расскажут о важных законах и свойствах света. На выставке Light Alive даже профильные специалисты и скептики смогут почувствовать себя детьми, которые верят в чудеса. Будут работать несколько тематических локаций:  музейная часть с представленной в зале голографией;   интерактивная площадка, где экспонаты можно и нужно трогать;   зеркальная комната Леонардо;    комната цветных теней;   волшебная комната Алисы.   ",exhibition
1074,концерт The Two Dutch Tenors,"При любой погоде атмосфера на крыше Hi-Hat будет царить тёплая и солнечная. Здесь выступит трио из Нидерландов The Two Dutch Tenors, в состав которого входят саксофонисты Каспар фан Вайк и Гидеон Тазелар, а также контрабасист Тис Лааркер, покорившие множество европейских столиц. В джеме на основе известных мелодий, который устроят голландцы, примут участие и петербургские музыканты. Джазовые концерты с видом на вечерний Петербург — одна из самых ярких фишек Roof Music Fest, так что не стоит упускать случай застать интернациональную команду виртуозов в романтичной обстановке под открытым небом.",concert
1075,"акция: искрометная комедия «Операция ""Развод""» со скидкой 30%","В постановке, созданной в стиле легендарных кинолент «Блеф», «Ва-Банк» и «11 Оушенов», участвуют известные актёры отечественного кино — Георгий Штиль, Андрей Федорцов, Андрей Носков и других. Динамичная смена узнаваемых сцен, раз за разом переворачивающих происходящее с ног на голову, напоминает современную жизнь, когда возможны самые невероятные вещи. Зрителей ожидает не только заряд позитивных эмоций и прекрасного настроения, но и инструкция по выходу из запутанных ситуаций, которые на первый взгляд кажутся неразрешимыми. Спектакль идёт с антрактом. Действительны следующие цены со скидкой:  1750 рублей вместо 2500 на ряды с 1 по 3; 1400 рублей вместо 2000 на ряды с 6 по 8; 1050 рублей вместо 1500 на 10-й ряд; 840 рублей вместо 1200 на 12-й ряд.  В акции участвует ограниченное количество билетов. Чтобы участвовать в акции, вам понадобится:  Поделиться записью с друзьями в ВКонтакте. Отправить администратору сообщение с названием спектакля, необходимым количеством билетов, вашим телефонным номером и именем.  Подробнее о спектакле, сроках проведения и организаторе можно узнать в официальной группе в ВКонтакте.",stock
1080,выставка живописи Николая Шестопалова,"До революции Николай Шестопалов был одним из участников легендарного объединения «Мир искусства», создавал сатирическую графику. После 1917 года начал работать в историко-революционном жанре, став одним из завсегдатаев выставок Ассоциации художников революционной России. Экспозиция в Строгановском дворце знакомит зрителей с 70 произведениями мастера из собрания Русского музея и частных коллекций. Открытие выставки — 23 июня в 16:00.",exhibition
1083,выставка «Шнитке»,"В 2014 году музыкальный мир отпраздновал 80-летие со дня рождения Альфреда Шнитке. К этому событию была подготовлена большая выставка. Начав своё путешествие в Саратове, она побывала в Сочи и Москве и теперь, наконец, добралась до Петербурга. Экспозиция, дающая возможность познакомиться с биографией Альфреда Шнитке и открыть для себя все грани его гения, состоит из нескольких частей, которые рождают музыкальное повествование, сюиту. Биографический раздел включает в себя документы и фотографии, музыкальный — симфонические и камерно-инструментальные произведения маэстро. О работах композитора для театра рассказывают эскизы декораций и костюмов к нескольким постановкам. Особое место на выставке занимает документальный фильм, посвящённый Шнитке, и личные вещи мастера — книги, иконы, молитвенник. Переходя от экспоната к экспонату, зрители будут слышать голос композитора, ощущать его «незримое присутствие». Посетителям Музея музыки предстоит знакомство со Шнитке-сочинителем, Шнитке-мыслителем и, конечно, Шнитке-человеком. На счету Шнитке — оперы, балеты, симфонии, концерты, вокальные и хоровые произведения, сочинения для клавишных инструментов, музыка к фильмам и спектаклям. Его творчество — это поистине масштабные замыслы, мощная драматургия и нерв в каждом звуке.",exhibition
1084,акция: мультимедийная выставка «Микеланджело. Сотворение мира» со скидкой 30%,"Впечатляющее шоу приближает искусство великого скульптора и живописца к широкому зрителю, а те, кто хорошо знаком с творениями мастера, увидит их с новой, неожиданной стороны. Перед тем, как пройти в мультимедиазал, посетители окажутся в мастерской Микеланджело. Создатели выставки попробовали реконструировать святую святых гения, где создавались шедевры, а также показать, как можно воплотить те же художественные цели в наше время с помощью высоких технологий. В рамках акции действительны следующие цены:  345 рублей вместо 490 за билет для взрослого; 275 рублей вместо 390 за билет для школьника, пенсионера и студента; 840 рублей вместо 1200 за два взрослых билета и один школьный (семейный билет); 980 рублей вместо 1400 за два взрослых билета и два школьных (семейный билет).  Чтобы купить билеты по выгодной стоимости, необходимо:  Поделиться записью с друзьями в ВК.   Отправить администратору сообщение с названием спектакля, нужным количеством билетов, номером телефона и именем.  Подробнее об акции, сроках проведения и организаторе можно узнать в официальной группе в ВКонтакте.",stock
1088,концерт Yung Lean,"В свои 19 Jonatan Leandoer Håstad уже может похвастаться славой по обе стороны океана и недюжинным авторитетом в когорте саунд-продюсеров. С дебютным микстейпом и альбомом в 2013 году Yung Lean исколесил Старый и Новый свет, приобщая слушателей к изобретённому им же «вялому» хип-хопу, основанному на эмоциональном и атмосферном минорном звучании. Уже через год после высокого старта журнал XXL назвал артиста одним из 15 рэперов, которых обязательно нужно послушать, а в 2016-м исполнитель отправится в новое кругосветное путешествие, по ходу которого сделает остановку и в Aurora Concert Hall.",concert
1090,акция: трехдневный тур на озеро Селигер за 8700 рублей вместо 14590!,"Участники тура посетят главные достопримечательности этого северного края, угостятся селигерской ухой, вкусными местными напитками и традиционными русскими солениями, наберут святую воду из Оковецкого источника, восстановят силы и отдохнут душой. Стоимость билета включает:  проезд;   экскурсию по Валдаю, Верхнему Волочку, Торжку, Оковецкому ключу, городу Осташково, Ниловой Пустыни;  трассовую экскурсию, сопровождение гида по всему маршруту поездки;   две ночи в трёхзвёздочной гостинице «СДЛ» города Осташкова, номера с удобствами;   два завтрака, один обед в первый день.  По желанию участники могут оплатить:  экскурсию по вечернему Селигеру на теплоходе — 800 рублей;  обед в Торжке на третий день — 350 рублей;   развлекательную программу с дегустацией селигерской ухи и напитков в помещичьей усадьбе — 500 рублей.  Автобус отходит от Московского проспекта, дом 189 (метро «Московская»). Чтобы купить билеты по выгодной стоимости, необходимо:  Поделиться записью с друзьями в ВК.   Отправить администратору сообщение с названием экскурсии, нужным количеством билетов, номером телефона и именем.  Подробнее об акции, сроках проведения и организаторе можно узнать в официальной группе в ВКонтакте.",stock
1096,выставка «Ван Гог — Живые полотна»,"В здании газгольдера XIX столетия, где сегодня размещается креативное пространство «Люмьер-Холл», посетителей ждут более 300 живописных и графических работ Винсента Ван Гога. Шедевры голландского мэтра демонстрируются на огромных экранах в высоком разрешении. Атмосферу мультимедийного шоу поддерживает объёмный звук. Зрители смогут не только рассмотреть картины художника, но и узнать о биографии живописца и истории написания им самых известных произведений. На выходе с экспозиции работает творческая мастерская, где у каждого будет возможность создать собственный натюрморт с подсолнухами или деревенский пейзаж с неспокойным небом под руководством профессиональных художников. Детали уточняйте по телефону: +7 (812) 407-17-31.",exhibition
1097,выставка «Лотофагия»,"«Биофутуризм» — таким термином можно определить направление, в котором работает немецкий художник украинского происхождения Алёша (Aljoscha). В его творчестве искусство переплетается с синтетической биологией. Название выставки даёт отсылку к древнегреческому мифу о лотофагах — людях, поедавших лотосы и становившихся из-за их чудодейственных свойств счастливыми и беспечными. В своих работах Алёша раскрывает вопросы религиозного и философского характера. Где грань между живым и мёртвым? Действительно ли человек создан по образу и подобию Бога? Возможно ли в наше время найти совершенно новую эстетическую форму? Таковы проблемы, волнующие автора. Произведения Алёши хранят эстетику природных форм. Он «выращивает» их, словно кристаллы, нанося краску микродозами. В экспозицию «Лотофагия» входят объекты, графические листы и масштабные инсталляции художника. Алёша родился в Глухове, образование получил в Дюссельдорфской академии искусств и Зальцбургской летней академии искусств. В 2008 году одна из его работ получила первую премию на конкурсе XXXV Premio Bancaja. На счету мастера — выставки в Германии, России, Австрии, Испании, Болгарии и других странах. Вернисаж состоится 1 июля в 19:00 в галерее Anna Nova.",exhibition
1099,концерт группы «Мегаполис»,"На создание проекта «Из жизни планет» Олега Нестерова вдохновил короткий отрезок советской культурной истории, который мы зовём «оттепелью». Подъем отечественного кино закончился очередным закручиванием гаек, оставив на полках множество закрытых фильмов. Четырём неснятым картинами 60-х годов «Мегаполис» посвятили двойной альбом, специальный сайт и музыкальный спектакль, который вновь можно увидеть на Эрарта Сцене: полтора часа ностальгии по несбывшимся надеждам и ярким временам, чьё наследие ещё ждёт своего исследователя.",concert
1109,выставка «Роман Ляпин. 2856»,"Главный персонаж полотен Романа Ляпина — живущий собственной жизнью город. Обращаясь к классическим канонам живописи, художник обобщает пейзажи почти до абстракций. Хотя правильнее эти произведения называть не «пейзажами», а «портретами», ведь у города есть свой характер, настроение, прошлое и судьба. На картинах Ляпина узнаются Венеция, Феррара, Париж и, конечно, Петербург. Крупные уверенные экспрессивные мазки рождают подвижные эмоциональные образы. По окончании Мухинского училища Ляпин отправился в Италию — продолжать постижение искусства в Римской академии художеств. Такое образование не могло не сказаться на его мировоззрении: мастер умело сочетает русские реалистические традиции и смелость и безудержность современной итальянской живописи. Член Союза художников Санкт-Петербурга, Ляпин неоднократно участвовал в выставках в России и за рубежом. Его картины хранятся в собраниях итальянских, российских, немецких, французских, испанских, японских и американских коллекционеров. Экспозицию в Эрарте составляют более 50 живописных полотен и графических листов, выполненных Ляпиным в разные периоды творчества. Выставка может быть интересна как тем, кто уже знаком с работами мастера, так и тем, кто ценит живые яркие городские пейзажи «с настроением».",exhibition
1115,акция: посещение Музея эмоций за 300 рублей вместо 600,"Посетители музея попадут в эпицентр целого спектра человеческих эмоций — от любви до ненависти, от радости до отвращения. Эмоции создаются с помощью специального пространства и предметов. Посетители окажутся в зеркальной комнате и среди бесчисленных ромашек и сердечек, увидят трон, летающую собаку и даже гроб. Переходы от одного состояния в другое сопровождают особые коридоры, олицетворяющие смену эмоций. Создатель проекта петербургский художник Алексей Сергиенко задался целью воплотить чистые человеческие эмоции, не приукрашенные и не прикрытые маской, поэтому некоторые объекты могут вызывать очень мощный эмоциональный отклик зрителей. Чтобы купить билеты по выгодной стоимости, необходимо:  Поделиться записью с друзьями в ВК. Отправить администратору сообщение с названием события, нужным количеством билетов, номером телефона и именем.  Подробнее об акции, сроках проведения и организаторе можно узнать в официальной группе в ВКонтакте.",stock
