rowname,title,body_text,categories
665,акция: билеты в океанариум со скидкой 47%,"Санкт-Петербургский океанариум — это настоящий морской зоопарк, удивительный музей с живым экспонатами. Здесь вы можете увидеть вблизи существ, жизнь которых привязана к морю и океану: от глубоководных рыб до водоплавающих млекопитающих, от громадных акул до пестрых обитателей коралловых рифов. В океанариуме обитателей водной среды можно наблюдать в условиях, близких к естественным. Кроме того, в течение дня посетители могут увидеть одну из потрясающих шоу-программ, в которых блистают очаровательные тюлени и сногсшибательные акулы. Сервис «ГорБилет» проводит очередную акцию, участники которой смогут приобрести билет в океанариум с существенной скидкой — за 400 рублей вместо 750, сэкономив при этом 47% стоимости. Вход для малышей до 4 лет бесплатный, для деток 5-7 лет — 100 рублей. Забронировать свой горящий билет можно на сайте «ГорБилета». Подробнее об акции, сроках проведения и организаторе можно узнать в официальной группе в «ВКонтакте».",stock
667,Новогоднее шоу саксофонов,"Ничто так не поднимает настроение, как правильная музыка. Чтобы встретить наступающий праздник в отличном расположении духа, отправляйтесь за доброй порцией новогодних мелодий в Михайловский замок. Вечером 31 декабря в торжественной атмосфере Георгиевского зала для вас прозвучат самые популярные композиции в исполнении Итальянского оркестра саксофонов под управлением Федерико Мондельчи. «Чёртова дюжина» — так ещё их называют. В первую очередь потому, что участников 13. Но не только поэтому. Главная причина в том, что игра страстных итальянцев может покорить любого. И доказывайте потом, что не подпали под дьявольское обаяние! Кстати, не ожидайте одного лишь джаза. Программа концерта включает самые разные жанры: фольклор, классику и даже рок! А приятные подарки дополнят вечер и помогут сохранить память о нём ещё не один год.",concert
668,концерт «Новогодний бал Царицы ночи» в Театре «Зазеркалье»,"Встреча Нового года в «Зазеркалье» — это музыкальный, волшебный и красочный праздник. Образ героини знаменитой оперы — загадочный, манящий, восхитительный и нежный, но в то же время противоречивый и коварный. Она словно тропический цветок под звёздным небом. Если балом правит Царица ночи, то зрителей ждёт сказочное впечатление от вечера. Хозяйка бала и оперные артисты, восходящие звёзды «Зазеркалья», готовят праздничные сюрпризы, яркую музыкальную феерию. Прозвучит самая новогодняя музыка Вольфганга Амадея Моцарта, Жоржа Бизе, Джоаккино Россини, Джакомо Пуччини, Франца Легара, Иоганна Штрауса, а также фрагменты из знаменитых мюзиклов.",concert
675,выставка «Рене Магритт. Вероломство образов»,"В пространстве «Арт-банк» проходит выставка работ легендарного Рене Магритта из собраний европейских коллекционеров. Трубка, которая вовсе и не трубка, влюблённые с покрывающей их головы белой тканью, загадочный мужчина в шляпе-котелке — эти и другие образы неотделимы ни от творчества художника, ни от наследия сюрреалистов вообще. Картины-ребусы бельгийского мастера-мистификатора призывают зрителей к рассуждению о парадоксальности устройства мироздания и природе незримого, заставляют вглядываться в сущность предметов и не верить своим глазам, вдохновляют искать собственные объяснения увиденному. 3 ноября — в день открытия выставки — вход для всех посетителей с 12:00 до 13:00 будет свободным. Вечером в 19:00 состоится торжественный вернисаж, попасть на который можно по билету или приглашению. Дополнительная информация — на официальном сайте площадки или по телефону +7 (812) 448-20-28.",exhibition
676,выставка «Вторая страсть самурая»,"В переводе с японского слово «сюнга» означает «весенняя картинка», но её содержание не имеет ничего общего с пейзажами. Речь идёт об откровенных гравюрах, где безо всякой скромности рассказывается о моменте близости между двумя людьми. Некоторые изображения лишь дают намёк на происходящее, другие же решены со всеми подробностями. При этом и те, и другие обладают высокими эстетическими качествами. Сюнгу создавали многие известные мастера — Судзуки Харунобу, Андо Хиросигэ, Китагава Утамаро, Кацусика Хокусай. Гравюры, которые японские матери по традиции дарили своим дочерям накануне свадьбы, одних европейцев шокировали, а других, напротив, вдохновляли (Анри де Тулуз-Лотрек, Густав Климт). В «Арт-центре» в Перинных рядах экспонируются 65 произведений из собраний японских, китайских, американских и канадских коллекционеров. 10 ноября с 12:00 до 13:00 попасть на выставку можно бесплатно. В 19:00 гостям предлагается взглянуть на желание и искушение в японской гравюре при свечах. Дополнительную информацию можно узнать на официальном сайте площадки или по телефону +7 (812) 448-20-28.",exhibition
677,концерт «Голливуд в Новогоднем Петербурге»,"Эту музыку слышали миллионы посетителей кинотеатров по всему миру: тему из «Индианы Джонса», шпионский нуар из саги о «Джеймсе Бонде». При всей массовой известности эти мелодии давно прописались в репертуаре многих симфонических оркестров, поскольку написаны настоящими корифеями композиторского искусства и уже успели перейти в разряд современной классики. В концерте «Голливуд в новогоднем Петербурге» прозвучат части саундтреков к фильмам «Пираты Карибского моря», «Титаник», «Список Шиндлера», «Гладиатор» и другие мелодии авторства таких известных кинокомпозиторов, как Джон Уильямс, Генри Манчини, Эннио Морриконе, Джеймс Хорнер. Новую жизнь в музыкальную киноклассику вдохнёт петербургский коллектив Singolo Orchestra под руководством дирижёра Антона Гаккеля и виолончелиста Дмитрия Ганенко.",concert
678,акция: билеты на концерт «Рождественский Штраус. Лучшие вальсы» со скидкой до 50%,"В канун Нового года один из лучших петербургских оркестров готовит для горожан и гостей северной столицы особую программу, в которую вошли лучшие вальсы Иоганна Штрауса. Произведения этого венского композитора — жизнеутверждающие, радостные, позитивные — лучшее сопровождение для приближающихся праздников. Локацией для потрясающего симфонического концерта станет зал собора Петрикирха,ошеломляюще красивый в праздничном облачении. Участники очередной акции от сервиса «ГорБилет» смогут приобрести билеты на концерт «Рождественский Штраус. Лучшие вальсы» со существенной скидкой — до 50%. Так, билеты на балкон за 500 рублей будут стоить всего 250, в партер — 600-800 рублей вместо 800-1000. Условия участие неизменно просты, нужно:  Сделать в ВК репост записи «ГорБилета». Отправить администратору заявку-сообщение, указав название концерта, количество билетов для бронирования, свой номер телефона, имя и фамилию.  Подробнее об акции, сроках проведения и организаторе можно узнать в официальной группе в «ВКонтакте».",stock
679,выставка к 170-летию со дня рождения Николая Миклухо-Маклая,"Николай Миклухо-Маклай родился в Новгородской губернии в 1846 году. Впервые он принял участие в научной экспедиции в 1866 году: Эрнст Геккель предложил русскому студенту, обучавшемуся в Германии, сопроводить его на Канарские острова для изучения фауны. Юноша был ответственен за морские губки и в итоге даже открыл новый вид. Несколько лет спустя Миклухо-Маклай представил в Русское географическое общество программу экспедиции на тихоокеанские острова. В 1871 году он сошёл с судна «Витязь» на северо-восточное побережье Новой Гвинеи, ныне называющееся Берегом Маклая. Папуасы сначала приняли его за злого духа, но со временем стали относиться к исследователю как к равному. В общей сложности на остров он возвращался трижды. Выставка в Штаб-квартире Русского географического общества состоит из нескольких частей, соответствующих разным периодам жизни этнографа. Здесь можно увидеть документы, фотоснимки, планы путешествий, дневники, рисунки, письма и другие предметы, позволяющие составить представление как о деятельности Миклухо-Маклая и его вкладе в науку, так и о характере учёного. Выставка работает только по средам. Посещение осуществляется по предварительной записи: +7 (812) 315–85–35.",exhibition
683,концерт группы «Алиса»,"Прорываясь сквозь череду юбилеев, легенды русского рока и метала подходят к очередным празднествам на пике формы. Кинчеву в этом месяце стукнет 58, Вдовиченко — 45, дебютный альбом группы «Энергия» недавно отметил 30-летие, а в этом сентябре дискографию «Алисы» пополнила 20-я студийная пластинка «Эксцесс». Будто бы не замечая ход времени, они гремят пуще прежнего. Пронаблюдать за эволюцией звучания группы можно будет на концерте в «Космонавте», где музыканты исполнят много старого, нового и вечного.",concert
694,выставка «Природа 2.0. Человек и животное. Мимолётное и вечное»,"На выставке «Природа 2.0. Человек и животное. Мимолётное и вечное» представлены работы победителей этого года в номинации «Лучшая видеоинсталляция» из разных стран мира. Флора и фауна в эпоху технологий, синтез плоти и цифры, рыбы из мусора и, конечно же, котики — всё это ожидает посетителей Эрарты.",exhibition
707,концерт Егора Крида,"Видный участник рекорд-артели Black Star Inc., Егор Крид за каких-то несколько лет добился статуса молодой суперзвезды, чьи шоу уже попросту не умещаются на небольших площадках. Элегантно сочетая мелодичный поп и лирический хип-хоп, певец одно за другим покоряет женские сердца и собирает не только музыкальные награды: некоторые крупные модные порталы не раз признавали его самым стильным мужчиной. Завораживать зал этот парень и вовсе умеет как истинный профи: для выступления в А2 он готовит фееричный спектакль с живым звуком, мультимедийными инсталляциями и танцевальным перформансом.",concert
711,концерт Дэвида Гарретта,"Его называют Паганини XXI века и приглашают выступать в многотысячные залы по всему миру. Его стиль – это classical crossover, в котором шедевры мирового рока искусно переплетаются с произведениями академической музыки. В концертном сет-листе Дэвида Гарретта можно обнаружить и сюиты Баха, и сонаты Моцарта, и хиты AC/DC с Led Zeppelin, получающие новую жизнь в скрипичных аранжировках. Гарретт и постоянная спутница всех его выступлений, 300-летняя скрипка Страдивари, делили сцену с Андреа Бочелли, Иегуди Менухиным и работали с целой плеядой известных дирижёров, включая россиянина Владимира Спивакова. Под занавес года виртуозный музыкант-экспериментатор вновь завернёт к берегам Невы, где со сцены Ледового дворца предложит петербуржцам собственные прочтения классических произведений и бессмертных рок-шлягеров.",concert
712,концерт Максим,"За десять лет МакSим собрала внушительную коллекцию наград от музыкальных каналов, провела немало аншлаговых концертов на самых престижных площадках и даже однажды возглавила рейтинг самых влиятельных женщин России. Грандиозное шоу «Это же я» в БКЗ «Октябрьский», включающее в себя все хиты певицы и новые песни с альбома «Хорошо», станет подарком от МакSим всем поклонникам, которые поддерживали её все эти годы.",concert
713,концерт Анны Золотовой,"Звезда российской оперной сцены и лауреат международных и всероссийских конкурсов, Анна Золотова начала свой творческий путь в 18-летнем возрасте с выступления в Самарской консерватории. Ныне талантливая певица известна не только ценителям классики, но и огромной аудитории шоу «Голос», которое она покорила в 2012 году. Анна Золотова сохраняет верность принципам оперного искусства. Для концерта на сцене Культурного центра Елены Образцовой певица приготовила программу шедевров оперной и камерной музыки разных эпох от Моцарта до Верди и Чайковского. Музыкальную программу дополнят работы художника Дмитрия Кустановича и фотосессия от светского фотографа, который предоставит гостям концерта доступ к результатам своей работы. Гости концерта получат подарки от спонсоров:  скидку 5% при покупке картин и репродукций в Галерее Кустановича;     скидку 5% при покупке туров в любую точку мира и золотую карту клиента туристической компании «Южный Берег»;     именную золотую карту от концертного агентства MFP («ЭмЭфПи»), дающую скидку 15% на все последующие концерты.     Справки по телефонам: +7 (952) 368–39–66, +7 (911) 092–31–67. Цена билета на входе — 1000 рублей, в случае предзаказа — 650. Билеты доступны по ссылке (воспользуйтесь промокодом KudaGo и получите​ скидку 50 рублей).",concert
715,выставка «Зона освоения. Современное искусство Урала»,"В Эрарте можно увидеть арт-объекты представителей «уральского постперестроечного авангарда» Николая Федореева, Олега Елового и Владимира Жукова, живописные полотна и графические листы художников «нижнетагильской школы» Сергея Брюханова, Алексея Константинова и Евгения Черепанова, ассамбляжи Сергея Рожина, концептуальные снимки Георгия Майера и многое другое. Участники выставки — представители разных поколений, прибегающие в своём творчестве к несхожим художественным методам, однако роднит их стремление к уничтожению стереотипов и поиску новых пластических решений.",exhibition
717,выставка Рино Стефано Тальяфьерро «Красота»,"В своём проекте «Красота» итальянец Рино Стефано Тальяфьерро решил «вдохнуть жизнь» в картины Рубенса, Тициана, Караваджо и других мастеров кисти. Обратившись к компьютерной анимации, он подарил движение статичным изображениям, сделав это со всей деликатностью. В итоговое видео вошло более 100 полотен, охватывающих период от эпохи Возрождения до середины XIX столетия. Над звуковым оформлением работал Энрико Асколи. Тальяфьерро признаётся, что его задачей было воплотить на экране драматургию абсолютной красоты и идею быстротечности жизни. Завораживающее видео можно увидеть в Музее искусства Санкт-Петербурга XX–XXI веков.",exhibition
719,концерт группы «Моя Мишель»,"Легко, ненавязчиво, немного танцевально и неизменно соблазнительно группа «Моя Мишель» поёт о влюблённых парочках и романтических фантазиях, стремительно завлекая слушателей к новому формату гитарной музыки, понятному максимально широкой аудитории. Их песню про химию к мальчику взяли к себе в ротацию даже радиостанции, неохотно котирующие русскоязычное творчество, а невероятно стильный клип на композицию в Youtube уже просмотрели свыше полумиллиона пользователей. Летом команда выступила под открытым небом в центре Москвы на площадке Зелёного театра ВДНХ, а в декабре посетит питерский «Космонавт» уже с обновлённой программой.",concert
